<?xml version="1.0" encoding="UTF-8" standalone="no"?>
<!DOCTYPE Spielfeld SYSTEM "Spielfeld.dtd">

<Spielfeld height="9" width="9" randomMushrooms="no">
    <Leafs min="16" max="16" verteilung="zufaellig">
        <Leaf>
            <PositionX>4</PositionX>
            <PositionY>2</PositionY>
        </Leaf>
        <Leaf>
    		<PositionX>5</PositionX>
    		<PositionY>2</PositionY>
    	</Leaf>
    	<Leaf>
    		<PositionX>6</PositionX>
    		<PositionY>2</PositionY>
    	</Leaf>
    	<Leaf>
    		<PositionX>3</PositionX>
    		<PositionY>3</PositionY>
    	</Leaf>
    	<Leaf>
    		<PositionX>4</PositionX>
    		<PositionY>3</PositionY>
    	</Leaf>
    	<Leaf>
    		<PositionX>5</PositionX>
    		<PositionY>3</PositionY>
    	</Leaf>
    	<Leaf>
    		<PositionX>6</PositionX>
    		<PositionY>3</PositionY>
    	</Leaf>
    	<Leaf>
    		<PositionX>2</PositionX>
    		<PositionY>4</PositionY>
    	</Leaf>
    	<Leaf>
    		<PositionX>3</PositionX>
    		<PositionY>4</PositionY>
    	</Leaf>
    	<Leaf>
    		<PositionX>4</PositionX>
    		<PositionY>4</PositionY>
    	</Leaf>
    	<Leaf>
    		<PositionX>5</PositionX>
    		<PositionY>4</PositionY>
    	</Leaf>
    	<Leaf>
    		<PositionX>6</PositionX>
    		<PositionY>4</PositionY>
    	</Leaf>
    	<Leaf>
    		<PositionX>3</PositionX>
    		<PositionY>5</PositionY>
    	</Leaf>
    	<Leaf>
    		<PositionX>4</PositionX>
    		<PositionY>5</PositionY>
    	</Leaf>
    	<Leaf>
    		<PositionX>2</PositionX>
    		<PositionY>6</PositionY>
    	</Leaf>
    	<Leaf>
    		<PositionX>3</PositionX>
    		<PositionY>6</PositionY>
    	</Leaf>
    </Leafs>
    <Mushrooms min="1" max="1" verteilung="zufaellig">
    	<Mushroom>
    		<PositionX>1</PositionX>
    		<PositionY>0</PositionY>
    	</Mushroom>
    </Mushrooms>
    <Trees min="17" max="17" verteilung="zufaellig">
    	<Tree>
    		<PositionX>4</PositionX>
    		<PositionY>1</PositionY>
    	</Tree>
    	<Tree>
    		<PositionX>5</PositionX>
    		<PositionY>1</PositionY>
    	</Tree>
    	<Tree>
    		<PositionX>6</PositionX>
    		<PositionY>1</PositionY>
    	</Tree>
    	<Tree>
    		<PositionX>7</PositionX>
    		<PositionY>1</PositionY>
    	</Tree>
    	<Tree>
    		<PositionX>7</PositionX>
    		<PositionY>2</PositionY>
    	</Tree>
    	<Tree>
    		<PositionX>7</PositionX>
    		<PositionY>3</PositionY>
    	</Tree>
    	<Tree>
    		<PositionX>6</PositionX>
    		<PositionY>5</PositionY>
    	</Tree>
    	<Tree>
    		<PositionX>5</PositionX>
    		<PositionY>5</PositionY>
    	</Tree>
    	<Tree>
    		<PositionX>4</PositionX>
    		<PositionY>6</PositionY>
    	</Tree>
    	<Tree>
    		<PositionX>4</PositionX>
    		<PositionY>7</PositionY>
    	</Tree>
    	<Tree>
    		<PositionX>3</PositionX>
    		<PositionY>7</PositionY>
    	</Tree>
    	<Tree>
    		<PositionX>2</PositionX>
    		<PositionY>7</PositionY>
    	</Tree>
    	<Tree>
    		<PositionX>1</PositionX>
    		<PositionY>6</PositionY>
    	</Tree>
    	<Tree>
    		<PositionX>2</PositionX>
    		<PositionY>5</PositionY>
    	</Tree>
    	<Tree>
    		<PositionX>1</PositionX>
    		<PositionY>4</PositionY>
    	</Tree>
    	   	<Tree>
    		<PositionX>2</PositionX>
    		<PositionY>3</PositionY>
    	</Tree>
    	<Tree>
    		<PositionX>3</PositionX>
    		<PositionY>2</PositionY>
    	</Tree>
    	<Tree>
    		<PositionX>7</PositionX>
    		<PositionY>4</PositionY>
    	</Tree>
    </Trees>
     <Mouse>
    		<PositionX>8</PositionX>
    		<PositionY>3</PositionY>
    </Mouse>
     <Goal>
    	<PositionX>8</PositionX>
    	<PositionY>2</PositionY>
    </Goal>
</Spielfeld>
