<?xml version="1.0" encoding="UTF-8" standalone="no"?>
<!DOCTYPE Spielfeld SYSTEM "Spielfeld.dtd">

<Spielfeld height="10" width="7" randomMushrooms="yes">
    <Leafs min="5" max="5" verteilung="gleichmaessig">
        <Leaf>
            <PositionX>4</PositionX>
            <PositionY>5</PositionY>
        </Leaf>
        <Leaf>
            <PositionX>5</PositionX>
            <PositionY>3</PositionY>
        </Leaf>
    </Leafs>
    <Mushrooms min="4" max="5" verteilung="gleichmaessig">
        <Mushroom>
            <PositionX>6</PositionX>
            <PositionY>5</PositionY>
        </Mushroom>
        <Mushroom>
            <PositionX>6</PositionX>
            <PositionY>1</PositionY>
        </Mushroom>
    </Mushrooms>
    
    <Trees min="4" max="5" verteilung="gleichmaessig"> </Trees>
</Spielfeld>
