<?xml version="1.0" encoding="UTF-8" standalone="no"?>
<!DOCTYPE Spielfeld SYSTEM "Spielfeld.dtd">

<Spielfeld height="1" width="8" randomMushrooms="no">
    <Leafs min="1" max="1" verteilung="zufaellig">
        <Leaf>
            <PositionX>3</PositionX>
            <PositionY>0</PositionY>
        </Leaf>
        <Leaf>
            <PositionX>5</PositionX>
            <PositionY>0</PositionY>
        </Leaf>
        <Leaf>
            <PositionX>7</PositionX>
            <PositionY>0</PositionY>
        </Leaf>
    </Leafs>
    <Mushrooms min="0" max="0" verteilung="zufaellig"></Mushrooms>
    <Trees min="0" max="0" verteilung="zufaellig"></Trees>
    <Mouse>
    	<PositionX>0</PositionX>
    	<PositionY>0</PositionY>
    </Mouse>
    <Goal>
    	<PositionX>7</PositionX>
    	<PositionY>0</PositionY>
    </Goal>
</Spielfeld>